{
  "$schema": "../schema/lineage.schema.json",
  "id": "shanahan-kubiak",
  "name": "Shanahan / Kubiak Wide-Zone Tree",
  "patriarch": "Bill Walsh → Mike Shanahan & Gary Kubiak",
  "side": "offense",
  "description": "The most influential offensive lineage in modern NFL football. Stemming from Bill Walsh’s West Coast spacing and Mike Shanahan & Gary Kubiak’s legendary Denver Broncos zone-stretch run game. Powers today’s elite offenses led by Kyle Shanahan, Sean McVay, Klint Kubiak, Matt LaFleur, and Mike McDaniel through horizontal stretch runs, play-action deep shots, and disguise meshes identical for the first 1.2 seconds.",
  "rootNodes": [
    {
      "coachId": "bill-walsh",
      "children": [
        {
          "coachId": "mike-shanahan",
          "children": [
            {
              "coachId": "kyle-shanahan",
              "children": [
                {
                  "coachId": "klint-kubiak",
                  "children": []
                },
                {
                  "coachId": "mike-lafleur",
                  "children": []
                },
                {
                  "coachId": "mike-mcdaniel",
                  "children": []
                },
                {
                  "coachId": "matt-lafleur",
                  "children": []
                },
                {
                  "coachId": "ben-johnson",
                  "children": []
                }
              ]
            },
            {
              "coachId": "sean-mcvay",
              "children": [
                {
                  "coachId": "kevin-oconnell",
                  "children": []
                },
                {
                  "coachId": "liam-coen",
                  "children": []
                }
              ]
            },
            {
              "coachId": "gary-kubiak",
              "children": [
                {
                  "coachId": "kevin-stefanski",
                  "children": []
                }
              ]
            }
          ]
        }
      ]
    }
  ]
}
